,DOI,url,container_title,created_date_parts,issued_date_parts,language,publisher,title
0,10.1007/bf00703440,http://dx.doi.org/10.1007/bf00703440,Archives of Orthopaedic and Trauma Surgery,2004/11/30,1998,en,Springer Science and Business Media LLC,Report of eight cases of humeral fracture following the throwing of hand grenades
1,10.1007/s004210050268,http://dx.doi.org/10.1007/s004210050268,European Journal of Applied Physiology,2002/8/25,1997/10/1,,Springer Science and Business Media LLC,Effects of contract-relax stretching training on muscle performance in athletes
2,10.1080/014311697216621,http://dx.doi.org/10.1080/014311697216621,International Journal of Remote Sensing,2002/7/26,1997/12,en,Informa UK Limited,Global prediction of area change of suitable regions for cereal cultivation caused by global warming
3,10.1111/j.1469-7793.1997.259bc.x,http://dx.doi.org/10.1111/j.1469-7793.1997.259bc.x,The Journal of Physiology,2004/9/30,1997/11,en,Wiley,Mental rehearsal of motor tasks recruits a-motoneurones but fails to recruit human fusimotor neurones selectively
4,10.1136/bjsm.31.4.269,http://dx.doi.org/10.1136/bjsm.31.4.269,British Journal of Sports Medicine,2008/12/16,1997/12/1,en,BMJ,Sudden death from cardiovascular disease in young athletes: fact or fiction?
5,10.1146/annurev.ecolsys.28.1.621,http://dx.doi.org/10.1146/annurev.ecolsys.28.1.621,Annual Review of Ecology and Systematics,2002/7/27,1997/11,en,Annual Reviews,THE ECOLOGY OF INTERFACES:Riparian Zones
6,10.1177/070674379704200909,http://dx.doi.org/10.1177/070674379704200909,The Canadian Journal of Psychiatry,2017/1/6,1997/11,en,SAGE Publications,Depression in Primary Care—More like Asthma Than Appendicitis: The Michigan Depression Project
7,10.1192/bjp.171.6.519,http://dx.doi.org/10.1192/bjp.171.6.519,British Journal of Psychiatry,2008/10/15,1997/12,en,Royal College of Psychiatrists,Minor psychiatric disorder in NHS trust staff: Occupational and gender differences
8,10.1210/jc.82.12.4020,http://dx.doi.org/10.1210/jc.82.12.4020,Journal of Clinical Endocrinology & Metabolism,2004/2/25,1997/12/1,en,The Endocrine Society,Thyroid Nodules in the Follow-Up of Irradiated Individuals: Comparison of Thyroid Ultrasound with Scanning and Palpation
